{
  "schema_version": "1.0.0",
  "policy_name": "taskgenome-bench-v3-official-778",
  "expected_task_count": 778,
  "expected_manifest_sha256": "191587d6e35b794601c096e98133577ea497ab9e09936f6818d1b9e30a14264d",
  "expected_ordered_task_ids_sha256": "ebaae7f2252334ebccdead74b6c77f9653c615cd221a28b33821929b1619bcde",
  "expected_public_contexts": {
    "context.gene_gemini31pro": 778,
    "context.gene_opus48": 778,
    "context.legacy_skill": 778
  },
  "sources": {
    "scenario_root": "scenarios",
    "scan_non_official_scenarios": true,
    "collections": [
      {
        "name": "gene_gemini31pro",
        "path": "genes_gemini31pro",
        "task_file_regex": "^(T\\d{4})\\.json$"
      },
      {
        "name": "gene_opus48",
        "path": "genes_opus48",
        "task_file_regex": "^(T\\d{4})\\.json$"
      },
      {
        "name": "public_agent_skill",
        "path": "agent_skills_public_human_clean",
        "task_file_regex": "^(T\\d{4})\\.md$"
      },
      {
        "name": "rewritten_skill",
        "path": "skills_rewritten_full",
        "task_file_regex": "^(T\\d{4})\\.md$"
      }
    ]
  },
  "public_safety": {
    "max_text_scan_bytes": 536870912,
    "forbidden_asset_patterns": [
      "*/_evolve_log.jsonl",
      "*/_rewrite_log.jsonl",
      "*/_agent_skill_log.jsonl"
    ],
    "forbidden_content_regexes": []
  },
  "rules": [
    {
      "id": "exclude_non_official_scenarios",
      "priority": 1000,
      "match": {
        "scope": "scenario",
        "official": false
      },
      "classification": {
        "distribution": "excluded",
        "role": "excluded.non_official_task",
        "materialize": false
      }
    },
    {
      "id": "exclude_non_official_collection_tasks",
      "priority": 1000,
      "match": {
        "scope": "collection",
        "official": false
      },
      "classification": {
        "distribution": "excluded",
        "role": "excluded.non_official_task",
        "materialize": false
      }
    },
    {
      "id": "exclude_skillsbench_restricted_skill_packages",
      "priority": 950,
      "match": {
        "scope": "scenario",
        "official": true,
        "task_ids": [
          "T0464",
          "T0465",
          "T0466",
          "T0467",
          "T0469",
          "T0471",
          "T0473",
          "T0482",
          "T0483",
          "T0484",
          "T0485",
          "T0486"
        ],
        "relpaths": [
          "skill/pdf/**",
          "skill/pptx/**",
          "skill/xlsx/**"
        ]
      },
      "classification": {
        "distribution": "excluded",
        "role": "excluded.third_party.restricted_skill",
        "materialize": false
      }
    },
    {
      "id": "private_canonical_manifest",
      "priority": 500,
      "match": {
        "scope": "canonical",
        "relpaths": "manifest.json"
      },
      "classification": {
        "distribution": "private",
        "role": "canonical.manifest",
        "destination": "canonical/manifest.json",
        "materialize": true
      }
    },
    {
      "id": "private_legacy_compatibility_policy",
      "priority": 500,
      "match": {
        "scope": "canonical",
        "relpaths": "legacy_v25_unrunnable.json"
      },
      "classification": {
        "distribution": "private",
        "role": "canonical.legacy_compatibility_policy",
        "destination": "canonical/legacy_v25_unrunnable.json",
        "materialize": true
      }
    },
    {
      "id": "private_historical_selftest_report",
      "priority": 500,
      "match": {
        "scope": "canonical",
        "relpaths": "selftest_report.json"
      },
      "classification": {
        "distribution": "private",
        "role": "quality.historical_selftest_report",
        "destination": "quality/selftest_report.json",
        "materialize": true
      }
    },
    {
      "id": "public_task_prompt",
      "priority": 300,
      "match": {
        "scope": "scenario",
        "official": true,
        "relpaths": "task.md"
      },
      "classification": {
        "distribution": "public",
        "role": "prompt.task",
        "destination": "tasks/{task_id}/task.md"
      }
    },
    {
      "id": "public_legacy_skill_context",
      "priority": 300,
      "match": {
        "scope": "scenario",
        "official": true,
        "relpaths": "SKILL.md"
      },
      "classification": {
        "distribution": "public",
        "role": "context.legacy_skill",
        "destination": "contexts/legacy_skill/{task_id}.md"
      }
    },
    {
      "id": "public_task_metadata",
      "priority": 300,
      "match": {
        "scope": "scenario",
        "official": true,
        "relpaths": "metadata.json"
      },
      "classification": {
        "distribution": "public",
        "role": "metadata.task",
        "destination": "metadata/{task_id}.json"
      }
    },
    {
      "id": "public_runtime_libraries",
      "priority": 300,
      "match": {
        "scope": "scenario",
        "official": true,
        "relpaths": [
          "package/**",
          "acl/**",
          "custom_reg/**",
          "diag/**",
          "eventsource/**",
          "logparser/**",
          "stat_tests/**",
          "taxlib/**"
        ]
      },
      "classification": {
        "distribution": "public",
        "role": "runtime.library",
        "destination": "runtime/{task_id}/{relpath}"
      }
    },
    {
      "id": "private_official_skill_instructions",
      "priority": 700,
      "match": {
        "scope": "scenario",
        "official": true,
        "relpaths": [
          "skill/SKILL.md",
          "skill/**/SKILL.md"
        ]
      },
      "classification": {
        "distribution": "private",
        "role": "authoring.oracle_runtime_copy",
        "destination": "scenarios/{task_id}/{relpath}"
      }
    },
    {
      "id": "public_runtime_skill_packages",
      "priority": 300,
      "match": {
        "scope": "scenario",
        "official": true,
        "relpaths": "skill/**"
      },
      "classification": {
        "distribution": "public",
        "role": "runtime.skill_package",
        "destination": "runtime/{task_id}/{relpath}"
      }
    },
    {
      "id": "public_environment_definitions",
      "priority": 300,
      "match": {
        "scope": "scenario",
        "official": true,
        "relpaths": "environment/**"
      },
      "classification": {
        "distribution": "public",
        "role": "environment.definition",
        "destination": "environments/{task_id}/{relpath}"
      }
    },
    {
      "id": "public_ref_runner_input_data",
      "priority": 300,
      "match": {
        "scope": "scenario",
        "official": true,
        "execution_modes": "subprocess_ref_runner",
        "relpaths": "data/**"
      },
      "classification": {
        "distribution": "public",
        "role": "runtime.public_input",
        "destination": "runtime/{task_id}/{relpath}"
      }
    },
    {
      "id": "private_pytest_case_data",
      "priority": 300,
      "match": {
        "scope": "scenario",
        "official": true,
        "execution_modes": "pytest_pkg",
        "relpaths": "data/**"
      },
      "classification": {
        "distribution": "private",
        "role": "judge.fixture",
        "destination": "scenarios/{task_id}/{relpath}"
      }
    },
    {
      "id": "private_generated_case_fixtures",
      "priority": 300,
      "match": {
        "scope": "scenario",
        "official": true,
        "relpaths": "_fixtures/**"
      },
      "classification": {
        "distribution": "private",
        "role": "judge.fixture",
        "destination": "scenarios/{task_id}/{relpath}"
      }
    },
    {
      "id": "private_gold_assets",
      "priority": 300,
      "match": {
        "scope": "scenario",
        "official": true,
        "relpaths": [
          "_gold/**",
          "_gold.json"
        ]
      },
      "classification": {
        "distribution": "private",
        "role": "judge.gold",
        "destination": "scenarios/{task_id}/{relpath}"
      }
    },
    {
      "id": "private_evaluator",
      "priority": 300,
      "match": {
        "scope": "scenario",
        "official": true,
        "relpaths": "test_script.py"
      },
      "classification": {
        "distribution": "private",
        "role": "judge.evaluator",
        "destination": "scenarios/{task_id}/{relpath}"
      }
    },
    {
      "id": "private_references",
      "priority": 300,
      "match": {
        "scope": "scenario",
        "official": true,
        "relpaths": [
          "reference_solution.py",
          "reference_solution.sh"
        ]
      },
      "classification": {
        "distribution": "private",
        "role": "reference.solution",
        "destination": "scenarios/{task_id}/{relpath}"
      }
    },
    {
      "id": "private_oracle_skill",
      "priority": 300,
      "match": {
        "scope": "scenario",
        "official": true,
        "relpaths": "SKILL_oracle.md"
      },
      "classification": {
        "distribution": "private",
        "role": "authoring.oracle_skill",
        "destination": "scenarios/{task_id}/{relpath}"
      }
    },
    {
      "id": "private_scenario_specification",
      "priority": 300,
      "match": {
        "scope": "scenario",
        "official": true,
        "relpaths": "scenario.yaml"
      },
      "classification": {
        "distribution": "private",
        "role": "authoring.scenario",
        "destination": "scenarios/{task_id}/{relpath}"
      }
    },
    {
      "id": "private_task_provenance",
      "priority": 300,
      "match": {
        "scope": "scenario",
        "official": true,
        "relpaths": [
          "_run_record.json",
          "_variants.json"
        ]
      },
      "classification": {
        "distribution": "private",
        "role": "provenance.task",
        "destination": "scenarios/{task_id}/{relpath}"
      }
    },